{
  "id_partido": "2026-2027_divisio-honor_G1_J1_20212400-1297",
  "acta_publicada": true,
  "federacion": "Real Federación Española de Tenis de Mesa",
  "temporada": "2026/2027",
  "genero": "femenino",
  "competicion": "División de Honor Femenina",
  "grupo": 1,
  "jornada": 1,
  "fecha": "2026-09-26",
  "hora": "16:30",
  "lugar": {
    "ciudad": "Burgos (Burgos)",
    "recinto": "SALA DE TENIS DE MESA DE BURGOS"
  },
  "equipos": {
    "local": {
      "id": "20212400",
      "nombre": "UBU RM TERAN BURGOS",
      "delegado": null,
      "entrenador": null
    },
    "visitante": {
      "id": "1297",
      "nombre": "IRUN LEKA ENEA CETD SONIA ETXAZARRETA",
      "delegado": null,
      "entrenador": null
    }
  },
  "abc_es_local": false,
  "arbitros": {
    "principal": {
      "nombre": "DELGADO AUSIN, MARIA",
      "licencia": "18427"
    },
    "asistente": null
  },
  "alineaciones": {
    "local": {
      "Y": {
        "nombre": "MENDEZ ALONSO, MARIA",
        "licencia": "30900"
      },
      "X": {
        "nombre": "HASEK MENDEZ, ESTHER",
        "licencia": "33469"
      },
      "Z": {
        "nombre": "DRANCA ODAIE , DORINA CODRUTA",
        "licencia": "21070"
      }
    },
    "visitante": {
      "A": {
        "nombre": "ZUAZUA ARISTIZABAL, MAITANE",
        "licencia": "30165"
      },
      "B": {
        "nombre": "LOPEZ ESCUDERO, PAULA",
        "licencia": "36162"
      },
      "C": {
        "nombre": "TECLA GHEMES, IOANA",
        "licencia": "17118"
      }
    }
  },
  "dobles": null,
  "partidos": [
    {
      "numero": 1,
      "tipo": "individual",
      "cruce": "A vs Y",
      "local": {
        "letra": "Y",
        "nombre": "MENDEZ ALONSO, MARIA",
        "licencia": "30900"
      },
      "visitante": {
        "letra": "A",
        "nombre": "ZUAZUA ARISTIZABAL, MAITANE",
        "licencia": "30165"
      },
      "sets": [
        {
          "set": 1,
          "local": 11,
          "visitante": 6
        },
        {
          "set": 2,
          "local": 11,
          "visitante": 9
        },
        {
          "set": 3,
          "local": 11,
          "visitante": 13
        },
        {
          "set": 4,
          "local": 9,
          "visitante": 11
        },
        {
          "set": 5,
          "local": 6,
          "visitante": 11
        }
      ],
      "resultado_juegos": {
        "local": 2,
        "visitante": 3
      },
      "ganador": "visitante",
      "marcador_acumulado": {
        "local": 0,
        "visitante": 1
      }
    },
    {
      "numero": 2,
      "tipo": "individual",
      "cruce": "B vs X",
      "local": {
        "letra": "X",
        "nombre": "HASEK MENDEZ, ESTHER",
        "licencia": "33469"
      },
      "visitante": {
        "letra": "B",
        "nombre": "LOPEZ ESCUDERO, PAULA",
        "licencia": "36162"
      },
      "sets": [
        {
          "set": 1,
          "local": 5,
          "visitante": 11
        },
        {
          "set": 2,
          "local": 11,
          "visitante": 7
        },
        {
          "set": 3,
          "local": 11,
          "visitante": 6
        },
        {
          "set": 4,
          "local": 11,
          "visitante": 4
        }
      ],
      "resultado_juegos": {
        "local": 3,
        "visitante": 1
      },
      "ganador": "local",
      "marcador_acumulado": {
        "local": 1,
        "visitante": 1
      }
    },
    {
      "numero": 3,
      "tipo": "individual",
      "cruce": "C vs Z",
      "local": {
        "letra": "Z",
        "nombre": "DRANCA ODAIE , DORINA CODRUTA",
        "licencia": "21070"
      },
      "visitante": {
        "letra": "C",
        "nombre": "TECLA GHEMES, IOANA",
        "licencia": "17118"
      },
      "sets": [
        {
          "set": 1,
          "local": 12,
          "visitante": 14
        },
        {
          "set": 2,
          "local": 11,
          "visitante": 6
        },
        {
          "set": 3,
          "local": 11,
          "visitante": 7
        },
        {
          "set": 4,
          "local": 11,
          "visitante": 7
        }
      ],
      "resultado_juegos": {
        "local": 3,
        "visitante": 1
      },
      "ganador": "local",
      "marcador_acumulado": {
        "local": 2,
        "visitante": 1
      }
    },
    {
      "numero": 4,
      "tipo": "individual",
      "cruce": "A vs X",
      "local": {
        "letra": "X",
        "nombre": "HASEK MENDEZ, ESTHER",
        "licencia": "33469"
      },
      "visitante": {
        "letra": "A",
        "nombre": "ZUAZUA ARISTIZABAL, MAITANE",
        "licencia": "30165"
      },
      "sets": [
        {
          "set": 1,
          "local": 11,
          "visitante": 5
        },
        {
          "set": 2,
          "local": 11,
          "visitante": 8
        },
        {
          "set": 3,
          "local": 11,
          "visitante": 7
        }
      ],
      "resultado_juegos": {
        "local": 3,
        "visitante": 0
      },
      "ganador": "local",
      "marcador_acumulado": {
        "local": 3,
        "visitante": 1
      }
    },
    {
      "numero": 5,
      "tipo": "individual",
      "cruce": "C vs Y",
      "local": {
        "letra": "Y",
        "nombre": "MENDEZ ALONSO, MARIA",
        "licencia": "30900"
      },
      "visitante": {
        "letra": "C",
        "nombre": "TECLA GHEMES, IOANA",
        "licencia": "17118"
      },
      "sets": [
        {
          "set": 1,
          "local": 6,
          "visitante": 11
        },
        {
          "set": 2,
          "local": 1,
          "visitante": 11
        },
        {
          "set": 3,
          "local": 11,
          "visitante": 3
        },
        {
          "set": 4,
          "local": 11,
          "visitante": 8
        },
        {
          "set": 5,
          "local": 6,
          "visitante": 11
        }
      ],
      "resultado_juegos": {
        "local": 2,
        "visitante": 3
      },
      "ganador": "visitante",
      "marcador_acumulado": {
        "local": 3,
        "visitante": 2
      }
    },
    {
      "numero": 6,
      "tipo": "individual",
      "cruce": "B vs Z",
      "local": {
        "letra": "Z",
        "nombre": "DRANCA ODAIE , DORINA CODRUTA",
        "licencia": "21070"
      },
      "visitante": {
        "letra": "B",
        "nombre": "LOPEZ ESCUDERO, PAULA",
        "licencia": "36162"
      },
      "sets": [
        {
          "set": 1,
          "local": 11,
          "visitante": 4
        },
        {
          "set": 2,
          "local": 12,
          "visitante": 10
        },
        {
          "set": 3,
          "local": 11,
          "visitante": 4
        }
      ],
      "resultado_juegos": {
        "local": 3,
        "visitante": 0
      },
      "ganador": "local",
      "marcador_acumulado": {
        "local": 4,
        "visitante": 2
      }
    },
    {
      "numero": 7,
      "tipo": "dobles",
      "cruce": "Db vs Db",
      "local": {
        "letra": "Db",
        "jugadores": []
      },
      "visitante": {
        "letra": "Db",
        "jugadores": []
      },
      "sets": [],
      "resultado_juegos": null,
      "ganador": null,
      "marcador_acumulado": {
        "local": 4,
        "visitante": 2
      },
      "no_disputado": true,
      "motivo": "Victoria decidida (4-2)"
    }
  ],
  "resultado_final": {
    "ganador": "UBU RM TERAN BURGOS",
    "marcador_partidos": {
      "local": 4,
      "visitante": 2
    },
    "marcador_juegos": {
      "local": 16,
      "visitante": 8
    }
  },
  "acta_protestada": false
}