{
  "id_partido": "2026-2027_divisio-honor_G3_J1_2017543-20222977",
  "acta_publicada": true,
  "federacion": "Real Federación Española de Tenis de Mesa",
  "temporada": "2026/2027",
  "genero": "femenino",
  "competicion": "División de Honor Femenina",
  "grupo": 3,
  "jornada": 1,
  "fecha": "2026-09-26",
  "hora": "18:00",
  "lugar": {
    "ciudad": "Priego de Córdoba (Córdoba)",
    "recinto": "Ciudad deportiva Carlos Machado"
  },
  "equipos": {
    "local": {
      "id": "2017543",
      "nombre": "MUSEO DE LA ALMENDRA FRANCISCO MORALES",
      "delegado": {
        "nombre": "CALVO MACHADO, ALEJANDRO",
        "licencia": "40155"
      },
      "entrenador": null
    },
    "visitante": {
      "id": "20222977",
      "nombre": "FUNDACIÓN SANDO NOVACARTAMA TM",
      "delegado": {
        "nombre": "Lic: Delegado Local: CALVO MACHADO, ALEJANDRO",
        "licencia": "40155"
      },
      "entrenador": {
        "nombre": "VARGAS POSTIGO, MIGUEL ANGEL",
        "licencia": "3838"
      }
    }
  },
  "abc_es_local": false,
  "arbitros": {
    "principal": {
      "nombre": "GARCIA COBO, RAFAEL",
      "licencia": "15454"
    },
    "asistente": null
  },
  "alineaciones": {
    "local": {
      "Y": {
        "nombre": "CONCHILLO MARTINEZ, ISABEL",
        "licencia": "27020"
      },
      "X": {
        "nombre": "ZIWEI , WANG",
        "licencia": "49233"
      },
      "Z": {
        "nombre": "BENITEZ DE LA FUENTE, ANDREA",
        "licencia": "26324"
      }
    },
    "visitante": {
      "A": {
        "nombre": "SLAMTI , NOUR",
        "licencia": "36157"
      },
      "B": {
        "nombre": "GÓMEZ LAMPRE, CARMEN",
        "licencia": "36718"
      },
      "C": {
        "nombre": "CRESPO CARDENAS, ESTELA MARÍA",
        "licencia": "50006"
      }
    }
  },
  "dobles": {
    "local": [
      {
        "nombre": "ZIWEI , WANG",
        "licencia": "49233"
      },
      {
        "nombre": "CONCHILLO MARTINEZ, ISABEL",
        "licencia": "27020"
      }
    ],
    "visitante": [
      {
        "nombre": "GÓMEZ LAMPRE, CARMEN",
        "licencia": "36718"
      },
      {
        "nombre": "CRESPO CARDENAS, ESTELA MARÍA",
        "licencia": "50006"
      }
    ]
  },
  "partidos": [
    {
      "numero": 1,
      "tipo": "individual",
      "cruce": "A vs Y",
      "local": {
        "letra": "Y",
        "nombre": "CONCHILLO MARTINEZ, ISABEL",
        "licencia": "27020"
      },
      "visitante": {
        "letra": "A",
        "nombre": "SLAMTI , NOUR",
        "licencia": "36157"
      },
      "sets": [
        {
          "set": 1,
          "local": 11,
          "visitante": 13
        },
        {
          "set": 2,
          "local": 11,
          "visitante": 4
        },
        {
          "set": 3,
          "local": 11,
          "visitante": 6
        },
        {
          "set": 4,
          "local": 11,
          "visitante": 8
        }
      ],
      "resultado_juegos": {
        "local": 3,
        "visitante": 1
      },
      "ganador": "local",
      "marcador_acumulado": {
        "local": 1,
        "visitante": 0
      }
    },
    {
      "numero": 2,
      "tipo": "individual",
      "cruce": "B vs X",
      "local": {
        "letra": "X",
        "nombre": "ZIWEI , WANG",
        "licencia": "49233"
      },
      "visitante": {
        "letra": "B",
        "nombre": "GÓMEZ LAMPRE, CARMEN",
        "licencia": "36718"
      },
      "sets": [
        {
          "set": 1,
          "local": 11,
          "visitante": 6
        },
        {
          "set": 2,
          "local": 11,
          "visitante": 5
        },
        {
          "set": 3,
          "local": 11,
          "visitante": 1
        }
      ],
      "resultado_juegos": {
        "local": 3,
        "visitante": 0
      },
      "ganador": "local",
      "marcador_acumulado": {
        "local": 2,
        "visitante": 0
      }
    },
    {
      "numero": 3,
      "tipo": "individual",
      "cruce": "C vs Z",
      "local": {
        "letra": "Z",
        "nombre": "BENITEZ DE LA FUENTE, ANDREA",
        "licencia": "26324"
      },
      "visitante": {
        "letra": "C",
        "nombre": "CRESPO CARDENAS, ESTELA MARÍA",
        "licencia": "50006"
      },
      "sets": [
        {
          "set": 1,
          "local": 7,
          "visitante": 11
        },
        {
          "set": 2,
          "local": 6,
          "visitante": 11
        },
        {
          "set": 3,
          "local": 9,
          "visitante": 11
        }
      ],
      "resultado_juegos": {
        "local": 0,
        "visitante": 3
      },
      "ganador": "visitante",
      "marcador_acumulado": {
        "local": 2,
        "visitante": 1
      }
    },
    {
      "numero": 4,
      "tipo": "individual",
      "cruce": "A vs X",
      "local": {
        "letra": "X",
        "nombre": "ZIWEI , WANG",
        "licencia": "49233"
      },
      "visitante": {
        "letra": "A",
        "nombre": "SLAMTI , NOUR",
        "licencia": "36157"
      },
      "sets": [
        {
          "set": 1,
          "local": 11,
          "visitante": 6
        },
        {
          "set": 2,
          "local": 11,
          "visitante": 4
        },
        {
          "set": 3,
          "local": 11,
          "visitante": 3
        }
      ],
      "resultado_juegos": {
        "local": 3,
        "visitante": 0
      },
      "ganador": "local",
      "marcador_acumulado": {
        "local": 3,
        "visitante": 1
      }
    },
    {
      "numero": 5,
      "tipo": "individual",
      "cruce": "C vs Y",
      "local": {
        "letra": "Y",
        "nombre": "CONCHILLO MARTINEZ, ISABEL",
        "licencia": "27020"
      },
      "visitante": {
        "letra": "C",
        "nombre": "CRESPO CARDENAS, ESTELA MARÍA",
        "licencia": "50006"
      },
      "sets": [
        {
          "set": 1,
          "local": 2,
          "visitante": 11
        },
        {
          "set": 2,
          "local": 7,
          "visitante": 11
        },
        {
          "set": 3,
          "local": 9,
          "visitante": 11
        }
      ],
      "resultado_juegos": {
        "local": 0,
        "visitante": 3
      },
      "ganador": "visitante",
      "marcador_acumulado": {
        "local": 3,
        "visitante": 2
      }
    },
    {
      "numero": 6,
      "tipo": "individual",
      "cruce": "B vs Z",
      "local": {
        "letra": "Z",
        "nombre": "BENITEZ DE LA FUENTE, ANDREA",
        "licencia": "26324"
      },
      "visitante": {
        "letra": "B",
        "nombre": "GÓMEZ LAMPRE, CARMEN",
        "licencia": "36718"
      },
      "sets": [
        {
          "set": 1,
          "local": 7,
          "visitante": 11
        },
        {
          "set": 2,
          "local": 11,
          "visitante": 7
        },
        {
          "set": 3,
          "local": 8,
          "visitante": 11
        },
        {
          "set": 4,
          "local": 11,
          "visitante": 5
        },
        {
          "set": 5,
          "local": 1,
          "visitante": 11
        }
      ],
      "resultado_juegos": {
        "local": 2,
        "visitante": 3
      },
      "ganador": "visitante",
      "marcador_acumulado": {
        "local": 3,
        "visitante": 3
      }
    },
    {
      "numero": 7,
      "tipo": "dobles",
      "cruce": "Db vs Db",
      "local": {
        "letra": "Db",
        "jugadores": [
          {
            "nombre": "ZIWEI , WANG",
            "licencia": "49233"
          },
          {
            "nombre": "CONCHILLO MARTINEZ, ISABEL",
            "licencia": "27020"
          }
        ]
      },
      "visitante": {
        "letra": "Db",
        "jugadores": [
          {
            "nombre": "GÓMEZ LAMPRE, CARMEN",
            "licencia": "36718"
          },
          {
            "nombre": "CRESPO CARDENAS, ESTELA MARÍA",
            "licencia": "50006"
          }
        ]
      },
      "sets": [
        {
          "set": 1,
          "local": 11,
          "visitante": 9
        },
        {
          "set": 2,
          "local": 11,
          "visitante": 13
        },
        {
          "set": 3,
          "local": 9,
          "visitante": 11
        },
        {
          "set": 4,
          "local": 11,
          "visitante": 4
        },
        {
          "set": 5,
          "local": 8,
          "visitante": 11
        }
      ],
      "resultado_juegos": {
        "local": 2,
        "visitante": 3
      },
      "ganador": "visitante",
      "marcador_acumulado": {
        "local": 3,
        "visitante": 4
      }
    }
  ],
  "resultado_final": {
    "ganador": "FUNDACIÓN SANDO NOVACARTAMA TM",
    "marcador_partidos": {
      "local": 3,
      "visitante": 4
    },
    "marcador_juegos": {
      "local": 13,
      "visitante": 13
    }
  },
  "acta_protestada": false
}