{
  "id_partido": "2026-2027_divisio-honor_G1_J1_866-1113",
  "acta_publicada": true,
  "federacion": "Real Federación Española de Tenis de Mesa",
  "temporada": "2026/2027",
  "genero": "femenino",
  "competicion": "División de Honor Femenina",
  "grupo": 1,
  "jornada": 1,
  "fecha": "2026-09-26",
  "hora": "17:30",
  "lugar": {
    "ciudad": "Vigo (Pontevedra)",
    "recinto": "PABELLÓN MUNICIPLA DE ROMIL"
  },
  "equipos": {
    "local": {
      "id": "866",
      "nombre": "ILLAS CÍES TENIS DE MESA",
      "delegado": null,
      "entrenador": {
        "nombre": "PINTOS BARREIRO, MARTIN",
        "licencia": "9975"
      }
    },
    "visitante": {
      "id": "1113",
      "nombre": "PONTEVEDRA T.M.",
      "delegado": null,
      "entrenador": {
        "nombre": "COBAS PENA, JUDITH",
        "licencia": "9186"
      }
    }
  },
  "abc_es_local": true,
  "arbitros": {
    "principal": {
      "nombre": "RODRIGUEZ RODRIGUEZ, ANGEL MANUEL",
      "licencia": "37510"
    },
    "asistente": null
  },
  "alineaciones": {
    "local": {
      "A": {
        "nombre": "LEBEDEVA , VIKTORIIA",
        "licencia": "27248"
      },
      "B": {
        "nombre": "PINTOS BARREIRO, LUISA",
        "licencia": "18412"
      },
      "C": {
        "nombre": "CARRASCO VIEITO, TERESA",
        "licencia": "34289"
      }
    },
    "visitante": {
      "Y": {
        "nombre": "BERNARDEZ MACEIRA, NOA",
        "licencia": "18409"
      },
      "X": {
        "nombre": "VIDAL BEN, LUCIA",
        "licencia": "29343"
      },
      "Z": {
        "nombre": "GUO CHEN, JIAQI",
        "licencia": "26947"
      }
    }
  },
  "dobles": null,
  "partidos": [
    {
      "numero": 1,
      "tipo": "individual",
      "cruce": "A vs Y",
      "local": {
        "letra": "A",
        "nombre": "LEBEDEVA , VIKTORIIA",
        "licencia": "27248"
      },
      "visitante": {
        "letra": "Y",
        "nombre": "BERNARDEZ MACEIRA, NOA",
        "licencia": "18409"
      },
      "sets": [
        {
          "set": 1,
          "local": 11,
          "visitante": 8
        },
        {
          "set": 2,
          "local": 11,
          "visitante": 9
        },
        {
          "set": 3,
          "local": 5,
          "visitante": 11
        },
        {
          "set": 4,
          "local": 11,
          "visitante": 8
        }
      ],
      "resultado_juegos": {
        "local": 3,
        "visitante": 1
      },
      "ganador": "local",
      "marcador_acumulado": {
        "local": 1,
        "visitante": 0
      }
    },
    {
      "numero": 2,
      "tipo": "individual",
      "cruce": "B vs X",
      "local": {
        "letra": "B",
        "nombre": "PINTOS BARREIRO, LUISA",
        "licencia": "18412"
      },
      "visitante": {
        "letra": "X",
        "nombre": "VIDAL BEN, LUCIA",
        "licencia": "29343"
      },
      "sets": [
        {
          "set": 1,
          "local": 12,
          "visitante": 10
        },
        {
          "set": 2,
          "local": 11,
          "visitante": 9
        },
        {
          "set": 3,
          "local": 12,
          "visitante": 10
        }
      ],
      "resultado_juegos": {
        "local": 3,
        "visitante": 0
      },
      "ganador": "local",
      "marcador_acumulado": {
        "local": 2,
        "visitante": 0
      }
    },
    {
      "numero": 3,
      "tipo": "individual",
      "cruce": "C vs Z",
      "local": {
        "letra": "C",
        "nombre": "CARRASCO VIEITO, TERESA",
        "licencia": "34289"
      },
      "visitante": {
        "letra": "Z",
        "nombre": "GUO CHEN, JIAQI",
        "licencia": "26947"
      },
      "sets": [
        {
          "set": 1,
          "local": 6,
          "visitante": 11
        },
        {
          "set": 2,
          "local": 6,
          "visitante": 11
        },
        {
          "set": 3,
          "local": 7,
          "visitante": 11
        }
      ],
      "resultado_juegos": {
        "local": 0,
        "visitante": 3
      },
      "ganador": "visitante",
      "marcador_acumulado": {
        "local": 2,
        "visitante": 1
      }
    },
    {
      "numero": 4,
      "tipo": "individual",
      "cruce": "A vs X",
      "local": {
        "letra": "A",
        "nombre": "LEBEDEVA , VIKTORIIA",
        "licencia": "27248"
      },
      "visitante": {
        "letra": "X",
        "nombre": "VIDAL BEN, LUCIA",
        "licencia": "29343"
      },
      "sets": [
        {
          "set": 1,
          "local": 10,
          "visitante": 12
        },
        {
          "set": 2,
          "local": 11,
          "visitante": 6
        },
        {
          "set": 3,
          "local": 11,
          "visitante": 6
        },
        {
          "set": 4,
          "local": 11,
          "visitante": 3
        }
      ],
      "resultado_juegos": {
        "local": 3,
        "visitante": 1
      },
      "ganador": "local",
      "marcador_acumulado": {
        "local": 3,
        "visitante": 1
      }
    },
    {
      "numero": 5,
      "tipo": "individual",
      "cruce": "C vs Y",
      "local": {
        "letra": "C",
        "nombre": "CARRASCO VIEITO, TERESA",
        "licencia": "34289"
      },
      "visitante": {
        "letra": "Y",
        "nombre": "BERNARDEZ MACEIRA, NOA",
        "licencia": "18409"
      },
      "sets": [
        {
          "set": 1,
          "local": 20,
          "visitante": 18
        },
        {
          "set": 2,
          "local": 7,
          "visitante": 11
        },
        {
          "set": 3,
          "local": 13,
          "visitante": 11
        },
        {
          "set": 4,
          "local": 11,
          "visitante": 5
        }
      ],
      "resultado_juegos": {
        "local": 3,
        "visitante": 1
      },
      "ganador": "local",
      "marcador_acumulado": {
        "local": 4,
        "visitante": 1
      }
    },
    {
      "numero": 6,
      "tipo": "individual",
      "cruce": "B vs Z",
      "local": {
        "letra": "B",
        "nombre": "PINTOS BARREIRO, LUISA",
        "licencia": "18412"
      },
      "visitante": {
        "letra": "Z",
        "nombre": "GUO CHEN, JIAQI",
        "licencia": "26947"
      },
      "sets": [
        {
          "set": 1,
          "local": 7,
          "visitante": 11
        },
        {
          "set": 2,
          "local": 7,
          "visitante": 11
        },
        {
          "set": 3,
          "local": 11,
          "visitante": 7
        },
        {
          "set": 4,
          "local": 11,
          "visitante": 4
        },
        {
          "set": 5,
          "local": 8,
          "visitante": 11
        }
      ],
      "resultado_juegos": {
        "local": 2,
        "visitante": 3
      },
      "ganador": "visitante",
      "marcador_acumulado": {
        "local": 4,
        "visitante": 2
      }
    },
    {
      "numero": 7,
      "tipo": "dobles",
      "cruce": "Db vs Db",
      "local": {
        "letra": "Db",
        "jugadores": []
      },
      "visitante": {
        "letra": "Db",
        "jugadores": []
      },
      "sets": [],
      "resultado_juegos": null,
      "ganador": null,
      "marcador_acumulado": {
        "local": 4,
        "visitante": 2
      },
      "no_disputado": true,
      "motivo": "Victoria decidida (4-2)"
    }
  ],
  "resultado_final": {
    "ganador": "ILLAS CÍES TENIS DE MESA",
    "marcador_partidos": {
      "local": 4,
      "visitante": 2
    },
    "marcador_juegos": {
      "local": 14,
      "visitante": 9
    }
  },
  "acta_protestada": false
}